"Data de referência dos dados: 04 de setembro de 2020","","","","","","","","","","","","","",""
"Empreendimento","Tipo","Status","UF","Potência","Curso d'água","Sub-bacia","Processo","Resolução","Empreendedores","Ato","Data ato","Validade ato","Latitude Eixo Barramento","Longitude Eixo Barramento"
"3 Alta","PCH","DRS-PCH","TO","7.67","do Peixinho","Tocantins, entre os rios Parana e do Sono","48500.001312/2015-11","875/2020","Soares Barros Engenharia - Eirel ","778","3/19/2020","2/16/2023","11°21'27""S","46°55'26""W"
"3JF","PCH","DRI-PCH","GO","8.5","Aporé","Paranaiba","48500.004157/2020-51","875/2020","3JF Participações Societárias Ltda. ","2.292","8/7/2020","10/7/2021","18°38'3""S","52°26'32""W"
"40 Ilhas","PCH","DRS-PCH","AM","8","Pitinga","Amazonas, entre os rios Madeira e Trombetas","48500.000124/2008-46","875/2020","Mineração Taboca S.A. ","3.343","10/3/2017","10/3/2020","0°53'21""S","59°35'2""W"
"A","PCH","DRS-PCH","MS","10","Sucuriú","Parana, Verde , Peixe, e outros","48500.001657/2012-21","875/2020","Energética das Emas Ltda. ","1.917","7/7/2020","","18°25'30,85""S","52°56'0""W"
"A. M. Dias","PCH","DRS-PCH","SC","5.2","Caveiras","Canoas","48500.002329/2012-42","875/2020","Pedras Brancas Geração de Energia S.A ","1.599","6/7/2017","6/7/2020","27°51'23,053""S","50°8'32,154""W"
"A41PA008 (Panama)","UHE","Registro Ativo","PA","870.4","Paru","Xingu e Paru","48500.006323/2014-14 E 48500.005280/2014-41","875/2020","Enel Brasil S.A. E  Zeta Energia S.A.","4744 (Pub: 10/12/2014) e 4104 (Pub: 13/10/2014)","","","01°02'34,49""S","53°09'40,45""W"
"Abelardo Luz","PCH","DRS-PCH","SC","29","Chapecó","Uruguai, Chapeco,Passo Fundo e outros","48500.003195/2006-68","875/2020","Elle Preto Adm.e Part. Comer. Imob. Ltda; Engevix Engenharia S.A.; ","880/2018 (Comunicado nº 04/2018)","","","26°33'29,15""S","52°20'23,13""W"
"Abelha Mirim","PCH","DRI-PCH","SC","7.7","Taió","Itajai","48500.003093/2019-38","875/2020","HIMASA – Heidrich Industrial Mercantil e Agrícola S.A ","1955","7/12/2019","9/12/2020","27°12'17,29""S","50°07'04,1""W"
"Açungui 2C","PCH","DRS-PCH","PR","13.1","Açungui","Ribeira do Iguape","48500.006595/2014-14","875/2020","Translead Empreendimentos e Incorporações Ltda. ","774","3/19/2020","12/13/2022","25°3'39""S","49°33'57""W"
"Açungui 2D","PCH","DRS-PCH","PR","12","Açungui","Ribeira do Iguape","48500.003382/2014-22","875/2020","Translead Empreendimentos e Incorporações Ltda. ","2.596","9/23/2019","9/2/2022","25°4'42,28""S","49°35'16,5""W"
"Açungui 2F","PCH","DRS-PCH","PR","9.9","Açungui","Ribeira do Iguape","48500.003383/2014-77","875/2020","Translead Empreendimentos e Incorporações Ltda. ","1.080","9/2/2019","9/2/2022","25°9'25,45""S","49°33'35,72""W"
"Açungui 2G","PCH","DRS-PCH","PR","9.5","Açungui","Ribeira do Iguape","48500.005074/2015-12","875/2020","Rohrbek Empreendimentos Imobiliários Ltda ","312/2017 (Comunicado nº 09/2020)","","","25°12'20,24""S","49°34'1,94""W"
"Água Boa","PCH","DRS-PCH","PA","8.5","Cupari","Tapajos","48500.000060/2013-41","875/2020","CIENGE Engenharia e Comércio Ltda. ","2.996/2016 (Cautelar nº 1936/2019)","","","4°10'33""S","55°1'46""W"
"Água Branca","PCH","DRS-PCH","PR","22","Ribeira","Ribeira do Iguape","48500.001716/2002-64","875/2020","CELER – Centrais Elétricas do Rio Ribeira ","905","4/7/2017","4/7/2020","24°55'29,633""S","49°32'27,057""W"
"Água Clara","PCH","DRS-PCH","MS","25","Rio Verde","Parana, Verde , Peixe, e outros","48500.003874/2001-03","875/2020","Minas PCH S.A. ","937","4/4/2019","4/4/2022","20°21'22""S","52°59'11""W"
"Água de Pedra","PCH","DRS-PCH","MT","9.502","Canamã","Madeira","48500.005796/2017-39","875/2020","Primus Incorporação e Construção Ltda. ","1.274","5/8/2019","5/8/2022","10°12'5,62""S","58°49'51,41""W"
"Água Limpa","PCH","DRI-PCH","PR","23.4","Goio-Erê","Parana, Paranapanema, Amambai e outros","48500.004207/2019-67","875/2020","Ravena Pesquisa Energética Ltda ","2.482","9/9/2019","11/9/2020","24°7'26""S","53°19'29""W"
"Água Limpa","UHE","Aceito","MT","320","das Mortes","Araguaia, trecho da ilha Bananal","48500.000410/2002-17","875/2020","Energética-Tech Engenharia Ltda; PCE - Projetos e Consultorias de Engenharia Ltda; ENERCAMP Engenharia e Comércio Ltda., Furnas Centrais Elétricas S.A., Alstom Hydro Energia Brasil Ltda.,
Construtora Andrade Gutierrez S.A. e Centrais Elétricas do Norte do Brasil S.A. – Eletronorte, inscritas
no CNPJ sob os nºs.  60.746.831/0001-39, 23.2","592","2/16/2009","","15°22'17,563""S","53°22'8,735""W"
"Água Limpa I","PCH","DRS-PCH","GO","20.1","Corrente","Paranaiba","48500.000351/2014-10","875/2020","J. Malucelli Energia S.A. ","103","1/21/2020","12/19/2022","18°57'20""S","51°19'41""W"
"Água Tremida","PCH","DRI-PCH","PR","11.7","Goio-Erê","Parana, Paranapanema, Amambai e outros","48500.005337/2018-36","875/2020","Ravena Pesquisa Energética Ltda ","2.407","10/25/2018","12/25/2019","23°58'24,102""S","52°58'47,897""W"
"Água Vermelha","PCH","DRS-PCH","MS","22","Coxim","Alto Paraguai","48500.004664/2008-07","875/2020","Bimetal Indústria Metalúrgica Ltda. ","195/2017 (Comunicado Nº 12/2020)","","","19°0'57,4""S","54°21'17,68""W"
"Águas de Ouro","PCH","DRS-PCH","SC","17","do Peixe","Uruguai, Inhanduva, Peixe e outros","48500.002493/2018-45","875/2020","Getop Empreendimentos e Gestão Ltda; Neimar Brusamarello; ","2.194","8/12/2019","8/12/2022","27° 21' 3,380"" S","51° 38' 48,920"" W"
"Águas do Chapecó","UHE","DRS-UHE","SC","41","Chapecó","Uruguai, Chapeco,Passo Fundo e outros","48500.005879/2010-51","875/2020","CPFL Energias Renováveis S.A.; Minas PCH S.A; ","3.092","12/26/2018","12/26/2021","27°3'18""S","52°58'32""W"
"Águas Lindas","UHE","DRS-UHE","PA","40","Cupari","Tapajos","48500.006604/2012-05","875/2020","CIENGE Engenharia e Comércio Ltda. ","3.717/2017 (Cautelar nº 1936/2019)","","","4°11'34,337""S","55°25'11,727""W"
"Aldeia","PCH","DRS-PCH","SC","14.5","Irani","Uruguai, Chapeco,Passo Fundo e outros","48500.006492/2011-01","875/2020","Elbrax Geração de Energias Limpas Ltda. ","2.957","11/5/2019","10/7/2022","27°10'14,743""S","52°31'18,856""W"
"Aldeia Velha","UHE","DRI-UHE","MG/RJ","32.506","Preto","Paraiba do Sul","48500.000160/2019-62","875/2020","EBDE Energia S.A. ","217","2/4/2019","4/4/2020","22°15'12,97""S","44°20'24,81""W"
"Alemães Baixo","PCH","DRS-PCH","MG","18.4","Abaeté","Das Velhas - Sao Francisco","48500.002523/2003-57","875/2020","Sigma Energia S.A ","813","4/4/2017","4/4/2020","18°10'18,394""S","45°35'20,655""W"
"Aliança","PCH","DRS-PCH","PR","5.54","Lajeado Grande","Parana, Iguacu","48500.002904/2016-31","875/2020","Electra Power Geração de Energia S.A. ","3.484","10/19/2017","10/19/2020","25°51'8""S","51°41'40""W"
"Aloândia","PCH","DRS-PCH","GO","19","Meia Ponte","Paranaiba","48500.005610/2010-75","875/2020","Minas PCH S.A.; Celg Geração & Transmissão S.A.; Sonnen Empreendimentos e Participações Ltda.","1.218","5/5/2020","1/17/2023","17°44'2""S","49°25'52""W"
"Alto Chopim","PCH","DRS-PCH","PR","21","Chopim","Parana, Iguacu","48500.000899/2017-11","875/2020","Alto Chopim Energia SPE Ltda. ","2.095","9/19/2018","9/19/2021","26°18'48,29""S","52°5'19,9""W"
"Alvorada I","PCH","DRS-PCH","GO","24","Corrente","Paranaiba","48500.000275/2014-42","875/2020","Minas PCH S.A.; Guerra Lage Engenheiros Associados Ltda.; ","3.278","11/27/2019","12/20/2022","19°4'0""S","51°10'30""W"
"Amparo","PCH","DRS-PCH","SC","7.5","Chapecó","Uruguai, Chapeco,Passo Fundo e outros","48500.002238/2007-14","875/2020","Adami S.A. - Madeiras ","10/2016 (Cautelar nº 1936/2019)","","","26°41'50""S","51°51'19,5""W"
"Ampére","PCH","DRS-PCH","PR","9.99","Capanema","Parana, Iguacu","48500.006138/2008-73","875/2020","GRX Engenharia Ltda. ","776","3/19/2020","1/19/2023","25°56'19""S","53°33'57""W"
"Andromix","PCH","DRS-PCH","SC","8.6","do Peixe","Uruguai, Inhanduva, Peixe e outros","48500.003378/2015-45","875/2020","Andromix Geração de Energia Ltda. ","1.209","5/4/2020","5/4/2023","27°6'55""S","51°18'38""W"
"Angatu I","PCH","DRS-PCH","MT","27","Cuiabá","Alto Paraguai","48500.003563/2016-11","875/2020","Maturati Participações S.A; Meta Serviços e Projetos Ltda.; ","1.478","6/1/2017","6/1/2020","15°8'49,04""S","56°27'2,46""W"
"Angatu II Montante","PCH","DRS-PCH","MT","19.89","Cuiabá","Alto Paraguai","48500.003442/2016-79","875/2020","Maturati Participações S.A; Meta Serviços e Projetos Ltda.; ","658","3/26/2018","3/26/2021","14°55'57,41""S","56°25'25,93""W"
"Antoninha","PCH","DRS-PCH","SC","19","Lava Tudo","Pelotas","48500.005069/2011-86","875/2020","Msul Energias Renováveis Ltda.; Trix Engenharia Civil Ltda.; ","3.446","12/16/2019","1/11/2023","28°14'43""S","50°13'17""W"
"Aparecida","PCH","DRS-PCH","SC","7.5","Chapecó","Uruguai, Chapeco,Passo Fundo e outros","48500.001359/2015-84","875/2020","Frigorífico Nutribrás Ltda.; Enebras Projetos De Usinas Hidrelétricas Ltda.; Da Luz Energia Ltda. , Agrícola Guerra Ltda. - EPP. , Prainha Camping Turismo Ltda. - ME","2.806","11/17/2016","4/26/2022","26°34'39""S","52°17'28,32""W"
"Apertados","UHE","Aceito","PR","135.5","Piquiri","Parana, Paranapanema, Amambai e outros","48500.001821/2010-39 e 48500.005190/2010-27","875/2020","Copel Geração e Transmissão S.A e Statkraft Energias Renováveis S.A ","1.138 (Pub. 10/04/2012) e 4.388 (Pub. 26/11/2009)","","","24°12'36""S","53°19'35""W"
"Apiúna","PCH","DRS-PCH","SC","27","Itajaí-Açu","Itajai","48500.006171/2005-25","875/2020","Apiúna Energia Ltda. ","657","3/28/2018","3/28/2021","27°4'41,575""S","49°26'37,823""W"
"Aporé","PCH","DRI-PCH","GO/MS","14","Aporé","Paranaiba","48500.003047/2020-72","875/2020","Enebras Projetos de Usinas Hidrelétricas; Enebras Projetos de Usinas Hidrelétricas; ","1.816","6/25/2020","8/25/2021","18°58'26""S","51°56'41""W"
"Araras","PCH","DRS-PCH","GO","6.6","das Almas","Tocantins, entre os rios Preto e Parana","48500.006902/2008-19","875/2020","Triton Energia Ltda. ","1.218","5/5/2020","3/31/2023","13°50'32""S","47°20'39""W"
"Araras","PCH","DRS-PCH","MT","9.5","Jauquara","Alto Paraguai","48500.001760/2016-03","875/2020","Prospecto Participações e Negócios Ltda. ","1.302","6/14/2018","6/14/2021","15°21'6,3""S","56°58'50,36""W"
"Aré","PCH","DRS-PCH","RJ","13.1","Muriaé","Paraiba do Sul","48500.006679/2008-00","875/2020","Rodrigo Pedroso Energia Ltda. ","3.362/2016 (Comunicado nº 08/2020)","","","21°15'3""S","41°47'43""W"
"Areado","PCH","DRS-PCH","MG","11.5","Ribeirão Areado","Das Velhas - Sao Francisco","48500.002954/2008-16","875/2020","LH Engenharia e Mineração Ltda.; Lig Móbile Telecomunicações Ltda.; ","3196","9/11/2015","9/11/2021","18°38'47,28""S","45°52'59,06""W"
"Areias","PCH","DRS-PCH","GO","12.5","Pilões","Alto Araguaia e rio Claro","48500.003567/2014-37","875/2020","CCB Energia S.A. ","1.218","5/5/2020","3/1/2023","16°20'54,71""S","50°46'47,59""W"
"Ari Franco","PCH","DRS-PCH","GO","26","Claro","Paranaiba","48500.003771/2011-13","875/2020","CELG Geração e Transmissão S.A.; FR Incorporadora Ltda.; EDP - Grupo Energest S.A., Construtora Queiroz Galvão S.A","3.157/2016 (Cautelar nº 1936/2019)","","","18°18'2,2""S","51°19'35,7""W"
"ARN-120 (Castanheira)","UHE","Aceito","MT","140","Arinos","Tapajos","48500.004214/2011-10","875/2020","Empresa de Pesquisa Energética - EPE ","1312","6/27/2016","","11°4'39""S","57°45'26""W"
"Arrieiros","PCH","DRS-PCH","PR","13","Ribeira do Iguape","Ribeira do Iguape","48500.005174/2008-10","875/2020","CELER – Centrais Elétricas do Rio Ribeira ","3.452","10/27/2017","10/27/2020","24°56'24,97""S","49°33'44,559""W"
"Arroio da Reserva","PCH","DRI-PCH","RS","5.85","Arroio da Reserva","Alto Jacui","48500.004383/2020-32","875/2020"," ","2.479","8/28/2020","10/28/2021","29°11'15,96""S","53°20'42,46""W"
"Assombrado","PCH","DRS-PCH","SC","16.5","do Peixe","Uruguai, Inhanduva, Peixe e outros","48500.003117/2015-25","875/2020","RTK Engenharia Ltda ","505","3/13/2018","3/13/2021","27°15'32,61""S","51°32'22,82""W"
"Atafona","PCH","DRI-PCH","RS","15.1","Ijuí","Uruguai, Ijui, piratinim e outros","48500.002063/2020-48","875/2020","Enebras Projetos de Usinas Hidrelétricas Ltda.; Frigorífico Nutribrás S.A.; Enebras Tecnologia Industrial Ltda., Coprel Cooperativa
de Geração de Energia e Desenvolvimento e à Cooperativa de Geração de Energia e Desenvolvimento Social Ltda.","1.398","5/20/2020","7/20/2021","28°20'44,33""S","54°20'47,14""W"
"Aurora","PCH","DRS-PCH","MA","9.1","Mearim","Pindare, Itapecuru, Mearim e outros","48500.003932/2008-65","875/2020","Rodrigo Pedroso Energia Ltda. ","3.094/2016 (Comunicado nº 08/2020)","","","5°44'50,9""S","45°45'48,5""W"
"Avuadeira","PCH","DRS-PCH","MT","22","das Garças","Alto Araguaia e rio Claro","48500.005584/2011-66","875/2020","Garças Energias e Participações S.A; Desa Rio das Garças Desenvolvimento Energético S.A.; ","1.218","5/5/2020","3/16/2023","15°59'24,219""S","53°25'16,313""W"
"Bacuri","PCH","DRS-PCH","GO","6.15","São Francisco","Paranaiba","48500.003401/2011-78","875/2020","Omega Desenvolvimento de Energia 1 S.A. ","561","2/24/2017","2/24/2020","18°21'59,477""S","50°22'3,434""W"
"Bacuri","PCH","DRS-PCH","MT","21.9","Ponte de Pedra","Tapajos","48500.005193/2002-80","875/2020","Empreendimentos Patrimoniais Santa Gisele Ltda. ","231/2016 (Cautelar nº 1936/2019)","","","13°37'32""S","57°23'29""W"
"Baixo Verde I","UHE","DRS-UHE","MS","27","Verde","Parana, Verde , Peixe, e outros","48500.001216/2014-91","875/2020","Minas PCH S.A ","2.855/2017 (Cautelar nº 1936/2019)","","","20°45'53,5""S","52°33'45""W"
"Baixo Verde III","UHE","DRS-UHE","MS","25","Verde","Parana, Verde , Peixe, e outros","48500.001442/2014-72","875/2020","Minas PCH S.A. ","2856","9/12/2017","9/12/2020","21°1'51""S","52°7'36""W"
"Balsa da Cachoeira","PCH","DRS-PCH","MG","20","Sapucaí","Grande","48500.003341/2014-36","875/2020","Minas PCH S.A.; Guerra Lage Engenheiros Associados Ltda.; ","164","1/29/2020","1/20/2023","21°32'9""S","45°41'49""W"
"Bandeira","PCH","DRS-PCH","PR","28","Piquiri","Parana, Paranapanema, Amambai e outros","48500.003089/2010-31","875/2020","Statkraft Energias Renováveis S.A. ","2.432","10/25/2018","10/25/2021","25°0'40""S","52°33'42""W"
"Barbosa Ferraz","PCH","DRS-PCH","PR","13.2","Corumbataí","Parana, Paranapanema, Amambai e outros","48500.005394/2015-72","875/2020","Grantec Técnica de Construção Ltda. ","1.218","5/5/2020","3/23/2023","24°2'55,81""S","51°56'49,67""W"
"Barra de Ferro","PCH","DRS-PCH","RS","6.8","Pardo","Alto Jacui","48500.004589/2011-71","875/2020","Três Fronteiras Geração de Energia Ltda. ","774","3/19/2020","12/13/2022","29°17'24,07""S","52°42'21,56""W"
"Barra do Ituim","PCH","DRS-PCH","RS","7.4","Turvo","Taquari","48500.000951/2013-05","875/2020","Vale do Turvo Hidrelétrica Ltda. ","3.226","11/26/2019","1/25/2023","28°38'55,775""S","51°24'41,489""W"
"Barra do Jaguari","PCH","Registro Ativo","MS","25.7","Amambaí","Parana, Paranapanema, Amambai e outros","48500.001176/2015-69 e 48500.002366/2015-01","875/2020","Ecoger - Ecologino Geração de Energia em Matriz Renovável Ltda. E Omega Desenvolvimento de Energia 1 S.A. ","932 (Pub: 06/04/2015) e 1.912 (Pub: 11/06/2015)","","","22°54'5,099""S","54°54'13,977""W"
"Barra do Pinheiro","PCH","DRS-PCH","SC","14.7","do Peixe","Uruguai, Inhanduva, Peixe e outros","48500.003448/2015-65","875/2020","RTK Engenharia Ltda ","1.917","7/7/2020","5/20/2023","27°21'37,79""S","51°44'10,31""W"
"Barra do Telha","PCH","DRS-PCH","RS","9.3","Ituim","Taquari","48500.005331/2014-35","875/2020","Ecoz Empreendimentos Imobiliários Ltda; Enebras Projetos de Usinas Hidrelétricas Ltda; Sandro Botta (CPF n° 618.220.009-04, Daniel Zonta","1.723","2/10/2019","2/10/2022","28°35'00""S","51°19'43""W"
"Barra dos Caixões","PCH","DRS-PCH","RS","9.9","Jacuizinho","Alto Jacui","48500.001077/2015-87","875/2020","Barra dos Caixões Empreendimentos em Energia Ltda ","41","1/21/2019","4/15/2022","29°11'54,91""S","53°4'23,03""W"
"Barracão","PCH","DRS-PCH","RS","9.8","Bernardo José","Pelotas","48500.005954/2013-27","875/2020","Enebras Projetos de Usinas Hidrelétricas Ltda; Cooperativa de Geração de Energia e Desenvolvimento Social Ltda. - Ceriluz; ","1.218","5/5/2020","3/14/2020","27°49'10,18""S","51°22'26,47""W"
"Barreiro","PCH","DRI-PCH","MS","24.1","Pardo","Parana, Verde , Peixe, e outros","48500.004029/2020-16","875/2020","Enebras Projetos de Usinas Hidrelétricas Ltda; Hacker Industrial Ltda; ","2.307","8/10/2020","10/10/2021","21°34'43""S","53°0'37""W"
"Barro Preto","PCH","DRS-PCH","MG","20","Manhuaçu","Doce","48500.005529/2011-76","875/2020","Minas PCH S.A. ","2836","9/8/2017","9/8/2020","19°31'46,677""S","41°27'11,076""W"
"Baru","PCH","DRS-PCH","MS","5.1","Taquarizinho","Alto Paraguai","48500.005306/2018-85","875/2020","Black Suffolk Participações e Assessoria Ltda. ","1.759","6/22/2020","6/22/2023","18°36'04,7""S","54°45'31,93""W"
"Beira Rio","PCH","DRS-PCH","PR","18.15","Jaguariaíva","Parana, Paranapanema, Amambai e outros","48500.005114/2015-26","875/2020","Pesqueiro Energia S.A. ","1.218","5/5/2020","3/23/2023","24°6'49""S","49°37'58""W"
"Bela Vista","PCH","DRS-PCH","MG","10.7","Pomba","Paraiba do Sul","48500.001787/2016-98","875/2020","SBE - Sociedade Brasileira de Energia Renovável Ltda. ","3.201/2016 (Comunicado nº 08/2020)","","","21°27'50""S","42°20'7""W"
"Bem Querer J1A","UHE","Registro Ativo","RR","708.4","Branco","Negro","48500.005532/2011-90","875/2020","Empresa de Pesquisa Energética - EPE ","1.060","4/17/2020","7/31/2023","1°52'40""S","61°1'57""W"
"Boa Vista","PCH","Aceito","GO/TO","5.1","Mosquito","Tocantins, entre os rios Preto e Parana","48500.000161/2013-11","875/2020","JA Incorporadora Ltda. e CELG Geração e Transmissão S.A.; CELG Geração e Transmissão S.A; ","779","3/31/2014","","12°52'5,561""S","46°21'59,528""W"
"Boa Vista","PCH","DRS-PCH","GO","12","Doce","Paranaiba","48500.000043/2011-41","875/2020","FR Incorporadora Ltda. ","776","3/19/2020","1/6/2023","18°12'59,944""S","51°7'37,762""W"
"Boa Vista","PCH","DRS-PCH","MG","16","Pardo","Grande","48500.000923/2016-22","875/2020","DME Energética S.A. - DMEE ","1.218","5/5/2020","3/23/2020","21°42'47,213""S","46°26'58,424""W"
"Boa Vista","PCH","DRS-PCH","MG","8","Suaçuí Pequeno","Doce","48500.003699/2015-40","875/2020","Brix Empreendimentos Imobiliários Ltda. ","1.218","5/5/2020","3/23/2023","18°39'37,67""S","42°14'51,63""W"
"Boa Vista","PCH","DRS-PCH","RJ","14","Grande","Paraiba do Sul","48500.003278/2018-61","875/2020","Pequena Central Hidrelétrica Boa Vista Energética SPE Ltda. ","855","3/30/2020","3/30/2023","21°52'6,86""S","42°1'35,31""W"
"Boaventura","UHE","DRS-UHE","MT","38.1","das Garças","Alto Araguaia e rio Claro","48500.002083/2014-71","875/2020","Energias Complementares do Brasil Geração de Energia Elétrica S.A. ","4.145","12/14/2017","12/14/2020","15°51'18,07""S","52°30'59,44""W"
"Bocaina","PCH","DRI-PCH","MS","11","Negrinho","Alto Paraguai","48500.007094/2019-51","875/2020","Enebras Projetos de Usinas Hidrelétricas Ltda.; Frigorífico Nutribrás S.A.; ","826","3/24/2020","5/24/2021","19°15'39,05""S","55°0'17,46""W"
"Bocaina","PCH","DRS-PCH","MG","5.75","Ribeirão Jordão","Paranaiba","48500.000035/2014-48","875/2020","Autazes Empreendimentos e Participações Ltda. ","3.584","12/19/2019","8/18/2022","18º28’04’’S","48º05’46’W’"
"Bom Jardim","PCH","DRS-PCH","GO","6.3","Preto","Paranaiba","48500.004448/2011-59","875/2020","Omega Energia Renovável S.A. ","3.062","11/29/2016","11/29/2019","18°29'4""S","50°32'18""W"
"Bom Jesus","PCH","DRS-PCH","MT","8.75","Prata ou Tadarimana","Alto Paraguai","48500.003562/2016-76","875/2020","Bom Jesus Agropecuária Ltda. ","4.012","12/4/2017","12/4/2020","16°43'46,97""S","53°49'44,66""W"
"Bom Retiro","UHE","Registro Ativo","RS","35.18","Taquari","Taquari","27101.000463/1989-40","875/2020","Bom Retiro Energia Ltda. ","49-SPH/1.999 (Anulação Judicial nº 7.995/2019)","2/4/1999","","29°36'32,06""S","51°57'0,98""W"
"Bom Retiro","UHE","DRS-UHE","MG","31.0014","Piranga","Doce","48500.005880/2010-86","875/2020","CPFL Energias Renováveis S.A. ","858","3/27/2020","3/27/2023","20°25'53""S","42°59'14""W"
"Bom Retiro","PCH","DRS-PCH","SC","5.5","Irani","Uruguai, Chapeco,Passo Fundo e outros","48500.003529/2014-84","875/2020","Rafitec S/A Indústria e Comércio de Sacarias ","433/2016 (Comunicado nº 07/2019)","","","26°56'54,13""S","52°13'13,69""W"
"Bom Sucesso","PCH","DRS-PCH","GO","6","Doce","Paranaiba","48500.000044/2011-96","875/2020","FR Incorporadora Ltda. ","776","3/19/2020","1/6/2023","17°51'49,963""S","51°18'4,515""W"
"Bom Sucesso","PCH","DRS-PCH","GO","26.1","Tocantinzinho","Alto Tocantins e rio Preto","48500.005847/2016-41","875/2020","RC Administração e Participações S.A. ","2.634","8/28/2017","8/28/2020","14°24'29,77""S","47°46'25,52""W"
"Bonança","PCH","DRS-PCH","RJ","9.8","Grande","Paraiba do Sul","48500.000179/2008-56","875/2020","Desenvix S.A. ","3.199/2015 (Comunicado nº 06/2018)","","","22°1'28,26""S","42°3'1,4""W"
"Bonasera","PCH","DRS-PCH","RS","30","Erexim","Uruguai, Chapeco,Passo Fundo e outros","48500.002016/2011-11","875/2020","Bonasera Energética S.A. ","2.213","7/31/2020","12/25/2022","27°32'50,4""S","52°40'11,13""W"
"Bonfim de Baixo","PCH","DRS-PCH","MG","8.505","Matipó","Doce","48500.001391/2018-11","875/2020","Liberum Energia Participações Ltda ","2.632","9/27/2019","9/27/2022","20°11'30""S","42°20'47""W"
"Bongiorno","PCH","DRS-PCH","RS","21","Erexim","Uruguai, Chapeco,Passo Fundo e outros","48500.002014/2011-14","875/2020","Bongiorno Energética S.A. ","640","3/16/2017","3/16/2020","27°29'32""S","52°42'20""W"
"Bonito A","PCH","DRS-PCH","PR","19.998","Piquiri","Parana, Paranapanema, Amambai e outros","48500.003087/2010-42","875/2020","Omega Desenvolvimento de Energia 1 S.A. ","2.750","9/5/2017","9/5/2020","25°0'14,98""S","52°4'25,817""W"
"Bonito B","PCH","DRS-PCH","PR","18","Piquiri","Parana, Paranapanema, Amambai e outros","48500.003085/2010-53","875/2020","Statkraft Energias Renováveis S.A. ","2.435","10/25/2018","10/25/2021","24°58'38,51""S","52°7'11,3""W"
"Botas","PCH","DRI-PCH","MS","18.2","Pardo","Parana, Verde , Peixe, e outros","48500.004015/2019-51","875/2020","Flamarpar Investimentos S.A. ","2.545","9/17/2019","11/17/2020","20°23'20""S","53°42'27""W"
"Braço Sul","PCH","DRS-PCH","MT","9.501","Braço Sul","Tapajos","48500.005564/2017-81","875/2020","Prospecto Participações e Negócios Ltda.; Vila Energia Renovável Ltda.; ","1.124","4/16/2019","4/16/2022","9°32'25,72""S","54°43'55,22""W"
"Brinquinho","PCH","DRS-PCH","GO","21","Doce","Paranaiba","48500.000049/2011-19","875/2020","FR Incorporadora Ltda. ","776","3/19/2020","1/6/2023","18°20'12,03""S","51°13'21,2""W"
"Bruaca","PCH","DRS-PCH","SC","15","da Bruaca","Cachoeira, Sao Joao e outros","48500.002724/2003-17","875/2020","Corupá Energia Ltda. ","1.965","7/18/2019","5/4/2022","26°25'17""S","49°22'55""W"
"Buriti Queimado","UHE","Registro Ativo","GO","142","Das Almas","Alto Tocantins e rio Preto","48500.006774/2001-67","875/2020","FURNAS-CENTRAIS ELÉTRICAS S.A ","3.165","12/31/2018","12/31/2020","14°50’17” S","49°12’40” W"
"Buritizinho","PCH","Aceito","GO","5.25","Ribeirão Cachoeirinha","Alto Tocantins e rio Preto","48500.003733/2007-76","875/2020","RC Administração e Participações S.A. ","2.872","8/4/2008","","14°37'11""S","47°46'21""W"
"Burro Branco","PCH","DRS-PCH","PR","10","da Areia","Parana, Iguacu","48500.000981/2017-37","875/2020","Dalba Engenharia e Empreendimentos Ltda. ","1.043","5/23/2018","5/23/2021","25°48'4,81""S","51°15'0,3""W"
"Butiá","PCH","DRS-PCH","PR","6","Butiá","Parana, Iguacu","48500.001803/2003-48","875/2020","Seta Engenharia S.A. ","91","1/16/2020","12/14/2022","26°3'46""S","52°5'20""W"
"Cabaçal 1","PCH","DRS-PCH","MT","13.5","Cabaçal","Alto Paraguai","48500.005944/2014-72","875/2020","São José Energia PCHs Ltda. ","1.713","6/17/2019","4/27/2022","15°23'57,45""S","58°5'39,27""W"
"Cabaçal 3","PCH","DRS-PCH","MT","7.5","Cabaçal","Alto Paraguai","48500.000417/2015-52","875/2020","Cabaçal Geração de Energia Elétrica Ltda. ","	1.983","7/18/2019","3/2/2022","15°7'6,5""S","58°26'19,27""W"
"Cabaçal 4","PCH","DRS-PCH","MT","6.2","Cabaçal","Alto Paraguai","48500.005937/2014-71","875/2020","São José Energia PCHs Ltda. ","492/2018 (Cautelar Judicial)","3/8/2018","","15°6'32,835""S","58°28'7,376""W"
"Cabaçal 5","PCH","DRS-PCH","MT","6.5","Cabaçal","Alto Paraguai","48500.005936/2014-26","875/2020","São José Energia PCHs Ltda. ","1.712","6/17/2019","5/30/2022","15°6'24,98""S","58°28'38,17""W"
"Cabaçal 6","PCH","DRS-PCH","MT","6.75","Cabaçal","Alto Paraguai","48500.005943/2014-28","875/2020","São José Energia PCHs Ltda. ","1.714","6/17/2019","5/30/2022","15°6'24,34""S","58°29'36,68""W"
"Cabrito","PCH","Aceito","RS","12","da Várzea","Uruguai, Varzea, Turvo e outros","48500.004758/2003-00","875/2020","Central Hidrelétrica Cabrito Ltda. ","1921","11/23/2005","","27°53'11""S","53°2'41""W"
"Cachimbo","PCH","DRS-PCH","MT","9.502","Braço Sul","Tapajos","48500.005658/2017-50","875/2020","Prospecto Participações e Negócios Ltda.; Vila Energia Renovável Ltda; ","2.975","11/6/2019","11/6/2022","9°48'20,58""S","54°52'59,78""W"
"Cachoeira","PCH","DRS-PCH","GO","21","Piracanjuba","Paranaiba","48500.002516/2011-45","875/2020","FR Incorporadora Ltda. ","52","1/13/2020","12/20/2022","16°56'31,354""S","48°4'56,177""W"
"Cachoeira","PCH","DRS-PCH","TO","5.5","Ribeirão do Inferno","Tocantins, entre os rios Preto e Parana","48500.000487/2008-81","875/2020","Agrícola Sete Campos Ltda. ","2.841","10/21/2019","1/13/2022","11°57'48,87""S","46°31'12,83""W"
